{
  "$schema": "../../docs/schemas/xake.project.schema.json",
  "name": "Xake",
  "project": "Xake.fsproj",
  "language": "fsharp",
  "kind": "library",
  "frameworks": ["net462", "netstandard2.0"],
  "sources": [
    "Prelude.fs",
    "Logging.fs",
    "Pickler.fs",
    "Env.fs",
    "Path.fs",
    "PathExt.fs",
    "File.fsi",
    "File.fs",
    "Fileset.fs",
    "Types.fs",
    "CommonLib.fs",
    "Database.fs",
    "RecipeBuilder.fs",
    "RecipeFunctions.fs",
    "WorkerPool.fs",
    "Resource.fs",
    "Progress.fs",
    "ExecTypes.fs",
    "XakeScript.fs",
    "DependencyAnalysis.fs",
    "ExecCore.fs",
    "VarEvaluation.fs",
    "ScriptRunner.fs",
    "XakeScriptBuilder.fs",
    "RuleBuilder.fs",
    "ScriptFuncs.fs",
    "Vars.fs",
    "Fingerprints.fs",
    "ProcessExec.fs",
    "FileTasksImpl.fs",
    "Tasks/Cp.fs",
    "Tasks/Rm.fs",
    "Tasks/Shell.fs",
    "Tasks/misc.fs",
    "Program.fs"
  ],
  "packages": [{ "id": "FSharp.Core", "version": "8.0.100" }],
  "options": { "doc": true },
  "internalsVisibleTo": ["Xake.Dotnet", "tests"]
}
