{
  "$schema": "../../docs/schemas/xake.project.schema.json",
  "name": "Xake.Hermetic.Dotnet",
  "project": "Xake.Hermetic.Dotnet.fsproj",
  "language": "fsharp",
  "kind": "library",
  "frameworks": ["net462", "netstandard2.0"],
  "sources": [
    "ToolJson.fs",
    "Roots.fs",
    "Nuget.fs",
    "Restore.fs",
    "Git.fs",
    "Lock.fs",
    "Described.fs",
    "Apps.fs",
    "RunFolder.fs",
    "Locks.fs",
    "Project.fs",
    "Import.fs",
    "Sbom.fs",
    "Verify.fs",
    "StrongName.fs",
    "Pack.fs",
    "Sign.fs"
  ],
  "packages": [
    { "id": "Xake", "version": "[3.11.0.40, 3.12)" },
    { "id": "FSharp.Core", "version": "8.0.100" }
  ],
  "options": { "doc": true },
  "internalsVisibleTo": ["hermetic.tests"],
  "byFramework": { "net462": { "references": ["System.IO.Compression"] } },
  "package": {
    "id": "Xake.Hermetic.Dotnet",
    "description": "Reproducible .NET builds for Xake: lock files, restore, SBOM, verification, packing and signing",
    "authors": "OlegZee",
    "copyright": "(c) OlegZee 2014-2026",
    "tags": ["reproducible", "lockfile", "sbom", "cyclonedx", "hermetic", "dotnet"],
    "license": "MIT",
    "projectUrl": "https://github.com/OlegZee/Xake",
    "repository": { "type": "git", "url": "https://github.com/OlegZee/Xake" },
    "icon": "../../Icon.png",
    "readme": "readme.md"
  }
}
